{
  "apiVersion": "aeon.dev/v1",
  "kind": "Job",
  "metadata": {
    "id": "job-valid-minimal",
    "createdAt": "2026-09-03T00:00:00Z"
  },
  "spec": {
    "stage": "executor",
    "argv": ["gromacs"],
    "timeoutSeconds": 60,
    "network": { "mode": "none" },
    "capabilityToken": "placeholder-capability-token"
  }
}
